Name	title	coding
t3_jxu9tg	Wisconsin’s Recount Will Only Serve to Confirm Donald Trump’s Humiliating Defeat	
t3_jywxtu	Michigan GOP Congressman Tells Trump 'It's Over': 'The Voters Spoke'	
t3_jykt2t	Trump forges ahead with frantic effort to overturn election | Having exhausted many of his legal options, Trump is looking at other ways to subvert Joe Biden’s victory.	
t3_jyeh3g	Trump’s last-ditch efforts to overturn results fail to make dent in Biden victory	
t3_jypw7q	Out of 53 Republican senators, only two have stood up to Trump's attempt to overturn the election	
t3_jyo46m	Trump Seeks Expedited Appeal of Pennsylvania Ruling Against Effort to Toss Mail-In Ballots	
t3_jz0nbc	Pressure grows from GOP for Trump to recognize Biden election win	
t3_jz2d5u	Ronna McDaniel has reportedly warned Donald Trump Jr., Kimberly Guilfoyle could succeed her as RNC chair	
t3_jywgwe	Republican senator congratulates Biden telling Trump to ‘accept outcome of election’	
t3_jxq0yf	Biden Must Keep His Word and Allow Investigations of Trump to Proceed	
t3_jyy2z6	Bolton calls on GOP leadership to label Trump's behavior 'inexcusable'	
t3_jxw6ms	Trump is trying to overturn an election he didn't win. We didn't get here by accident	
t3_jyhkqu	Judge rules against Trump global media chief after firings	
t3_jyz56l	Trump rails against Paris climate accord in virtual G20 event	
t3_jyga4y	Judge rules against Trump global media chief after firings	
t3_jy96f8	Shields and Brooks on the danger of Trump’s refusal to concede	
t3_jyar6j	Coronavirus updates: Donald Trump Jr. tests positive; model estimates 471k US deaths by March; Cuomo to receive International Emmy	
t3_jym2qo	Duty or Party? For Republicans, a Test of Whether to Enable Trump	
t3_jxze94	Ivanka Trump distances self from dad’s election fraud claims as her own legal jeopardy grows	
t3_jyejvj	Lara Trump reportedly mulling 2022 Senate run in North Carolina	
t3_jyg71f	NAACP Federal Suit: Trump Violated Voting Rights Act	
t3_jyy5hi	Trump, the Saboteur. First a Tantrum, Then Taking Every Opportunity to Trash Our Government	
t3_jye7eu	In 'Tremendous Rebuke' of Trump Appointee, Federal Judge Bars US Media Agency Head From Interfering in News Coverage | "Michael Pack has repeatedly and intentionally violated the First Amendment rights of VOA journalists."	
t3_jxyiu8	The Growing Backlash Against Trump's Efforts To Subvert The Election	
t3_jxscv0	Tucker Carlson calls out Trump's election lawyer for refusing to show evidence supporting the president's baseless voter fraud claims	
t3_jya174	Judge slaps down Trump appointee who has sought to reshape Voice of America and related agencies	
t3_jxuleo	It’s time for everyone to pick a side: America or President Trump	
t3_jyo1za	Donald Trump appears to admit Covid is 'running wild' in the US	
t3_jybdhg	Why Kemp formalized Georgia’s election despite Trump’s pushback	
t3_jz0vxg	Christie calls Trump's legal efforts a 'national embarrassment' as more Republicans speak out	
t3_jy38k5	CNN's Brianna Keilar rolls the tape on Donald Trump's history of baselessly claiming election fraud	
t3_jyoleb	Kayleigh McEnany said Trump wasn't given an 'orderly transition of power' in 2016. He was.	
t3_jyzr2m	A Republican judge just tore into Trump’s election lawyers for their incompetence. Trump’s lawyers asked a judge to disenfranchise nearly 7 million voters. It ended badly for Trump.	
t3_jy0een	Rudy Giuliani's Son Potentially Exposed Most of Trump's Legal Team to COVID During RNC Press Conference	
t3_jyunps	Trump, laden with $400 million debts, plans to cash in on his post-presidency with a book deal, media appearances, and selling rally tickets, according to a report	
t3_jycwb6	Meet Pennsylvania’s anger translator, and Donald Trump’s worst nightmare	
t3_jz3yzg	Pompeo says Mideast strategy will be Trump administration policy 'until our time is complete'	
t3_jydvyu	How Georgia's pro-Trump election chief became the bane of the GOP	
t3_jy0een	Rudy Giuliani's Son Potentially Exposed Most of Trump's Legal Team to COVID During RNC Press Conference	
t3_jyqcfr	After Pennsylvania court defeat, Trump faces new pressure to concede election	
t3_jyrnnk	Trump's attempt to steal the election unravels as coronavirus cases surge	
t3_jy9asn	Let's count the ways Donald Trump has tried to subvert this election, shall we?	
t3_jy2j68	Arizona’s largest county certifies Biden win over Trump	
t3_jyqqwc	FDA authorizes emergency use of the antibody cocktail given to Trump to treat Covid-19	
t3_jyn1nu	'Absolutely shameful': Schiff condemns Trump's golf outing	
t3_jxm95o	New York subpoenas Trump Organisation for details of consulting fees paid to Ivanka	
t3_jyll6a	Trump’s State Department to defund international non-profits that support BDS	
t3_jy09dz	Opinion: Hold President Trump accountable for his misdeeds	
t3_jymtbq	Megathread: Judge Dismisses Trump Lawsuit Seeking to Delay Certification in Pennsylvania	
t3_jz0yry	GOP Governor On Trump's Election Tantrum: Beginning To Look Like A 'Banana Republic' - "Frankly, I'm embarrassed that more people in the party aren’t speaking up," Maryland Gov. Larry Hogan said.	
t3_jxz18x	OMB Documents Obtained by Chairs Yarmuth, Lowey, Maloney Show Trump Admin Withheld WHO Funds to Combat the Coronavirus Pandemic with Same Tactic Used in Illegal Ukraine Impoundment	
t3_jyvp5p	Federal judge rejects Trump campaign's Pa. lawsuit with prejudice, saying it lacks factual proof	
t3_jyw2mu	Trump threatens to wreak havoc on the GOP from beyond the White House	
t3_jya79l	People Think Mnuchin Accidentally Said Trump Admin’s Most Honest Thing About COVID-19	
t3_jxori2	Solar Companies Ask Biden To Reverse Trump’s Biggest Blow To The Industry	
t3_jyb15a	U.S. exits Open Skies treaty Sunday, but could Biden undo Trump's withdrawal?	
t3_jz3iys	Small but growing number of Republicans tell Trump it's over: "Stop golfing and concede"	
t3_jymexa	RNC Backs Trump's Bogus Claims That He Won the Election	
t3_jyy5hi	Trump, the Saboteur. First a Tantrum, Then Taking Every Opportunity to Trash Our Government	
t3_jy1qop	After Trump meeting, Michigan GOP leaders say Biden's win still stands	
t3_jxw9t2	After Years of Watching ‘Trump Show,’ TV News Starts to Turn it Off	
t3_jz1z65	‘Stop golfing and concede’: Trump and Maryland Gov. Hogan spar again after president criticizes South Korean tests	
t3_jyxn1c	Chris Christie: Trump's legal challenges against election results have been "a national embarrassment"	
t3_jz0az8	Pennsylvania GOP Sen. Toomey Says Trump Should Accept Election Loss	
t3_jyd46w	Trump has longstanding history of calling elections 'rigged' if he doesn’t like the results	
t3_jyhutc	Obama jokes that Navy SEALs could remove Trump from the White House	
t3_jyefvb	Donald Trump says 'I won, by the way' and lashes out at Pfizer claiming it delayed news of the COVID-19 vaccine until after the election	
t3_jyza13	A Final Try by Trump to Cut Drug Prices May Stumble in Court	
t3_jxrs4e	Republican Party sparks backlash with "Trump won by a landslide" post: "What happened to you?"	
t3_jybnek	Trump tries to drum out GOP election officials who won’t play his games — Georgia Secretary of State Brad Raffensperger's family has received threats and he expects a primary challenge in 2022	
t3_jyzfzs	Chris Christie Says Trump's Legal Team Has Become a 'National Embarrassment'	
t3_jyat09	Michigan group sues Trump campaign for alleged mass voter suppression	
t3_jz3tv7	Ronna McDaniel has reportedly warned Donald Trump Jr., Kimberly Guilfoyle could succeed her as RNC chair	
t3_jz0akg	Trump, GOP’s ridiculous, flailing coup isn’t a joke. It’s a crime. There must be consequences | Will Bunch	
t3_jyl2mf	Trump skipped a coronavirus meeting with G20 leaders to play golf	
t3_jz071b	‘National Embarrassment’: Christie Blasts Trump’s Legal Team As Election Challenges Fizzle	
t3_jxqlnp	Mitt Romney on Trump: ‘It is difficult to imagine a worse, more undemocratic action by a sitting American President’	
t3_jz0mm7	Bolton: 'Trump is throwing rocks through windows'	
t3_jyvwlr	Democrats gear up for last oversight showdown with Trump	
t3_jz2622	Trump’s overarching Middle East strategy reaches a disastrous dead end	
t3_jxwnu3	Detroit asks judge to sanction Trump campaign for spreading 'disinformation'	
t3_jxotoe	Trump’s lawsuits plagued by spelling errors: ‘I’ve never seen an election lawyer handle a case as poorly as Giuliani has’	
t3_jyqowe	Michiganders Erupt After Their Maskless Lawmakers Sip Dom Perignon At Trump Hotel - Michigan legislators celebrate together after secretive meeting with Trump, who has been plotting to overturn the state’s vote for Joe Biden.	
t3_jz0nbc	Pressure grows from GOP for Trump to recognize Biden election win	
t3_jyxodl	U.S. courts find no voter fraud despite cries from Trump’s legal team	
t3_jxou52	GOP Sens. Romney and Sasse condemn Trump's election challenges, "We are a nation of laws, not tweets"	
t3_jz1z65	‘Stop golfing and concede’: Trump and Maryland Gov. Hogan spar again after president criticizes South Korean tests	
t3_jyyf6p	'Unacceptable': Wisconsin Election Officials Say Trump Observers Hindering Recount With Constant Interruptions, Questions	
t3_jyxqd1	Chris Christie: Trump's legal team 'a national embarrassment'	
t3_jy9clr	Trump wanted to bomb Iran — and still could — leaving Biden to pick up the pieces	
t3_jyevov	Trump Supporters in Georgia Threaten to Destroy GOP, Boycott Runoff Elections	
t3_jyn27t	FDA authroizes emergency use of Regeneron antibody treatment given to Trump	
t3_jy0zg7	Editorial: Trump’s effort to steal the election is a step toward fascism in America. If you call yourself a patriot, you can’t support it	
t3_jyi4xi	Impeach the president again — Removal from office wouldn’t be the goal this time. It would be to prevent Trump from running again.	
t3_jycdqu	Why Can Trump Try To Steal The Election? Blame The Electoral College.	
t3_jyauqo	Conspiracy theories are Trump ‘weapons’ in desperate bid to cling to power	
t3_jyn1np	GOP civil war inspired by Trump grips Georgia, threatens other states	
t3_jys1yc	Trump’s tyranny is the moral equivalent of treason	
t3_jyy5dt	Facebook, Instagram Will Switch White House Accounts From Trump to Biden on Jan. 20	
t3_jytj5f	Trump or No Trump, Religious Authoritarianism Is Here to Stay	
t3_jynt1e	Trump tells G20 leaders he wants to work with them ‘for a long time’	
t3_jxqqb8	Ivanka Trump’s Rage-Tweets About Ongoing Tax Fraud Investigations Have Serious Potential to Hurt Her Legal Defense	
t3_jxkgvx	‘No Pardons. No Immunity’: Mary Trump Says Her Family Must Pay	
t3_jybv6o	Will Trump Screw Up Republican Efforts to Hang Onto the Senate?	
t3_jya5eq	Culture wars fuel Trump’s blue-collar Latino gains: “Most Latinos identify first as working-class Americans. And Trump spoke to that.”	
t3_jy9z3h	Trump tries to leverage power of office to subvert Biden win	
t3_jxifvj	Romney accuses Trump of trying to ‘subvert the will of the people’ with election challenges	
t3_jypgsl	Trump's legal team requests recount of georgia presidential vote	
t3_jz1j0x	Chris Christie: Trump’s Legal Team Has Been a ‘National Embarrassment’	
t3_jyh4cs	As world leaders meet to talk pandemic, Trump checks out and hits the links	
t3_jz3cid	Can Republicans Get Trump-Style Turnout Without Trump on the Ballot?	
t3_jyjt9q	Battered by failures to reverse Biden win, Trump, allies persist with fraud claims	
t3_jywf6n	Trump formally requests recount in Georgia	
t3_jyeldv	A new lawsuit alleges Trump’s effort to overturn Michigan’s election results disenfranchises Black voters	
t3_jyjx9m	Romney vs. Chachi? Actor Scott Baio threatens to run against Utah senator in 2024 over Trump rebuke.	
t3_jyaacw	Kayleigh McEnany’s Latest Trump Lie Is Firmly Debunked In Viral Video	
t3_jy06aa	After Trump meeting, Michigan GOP lawmakers say they’re not aware of any info that would change Biden’s victory in state	
t3_jyf2se	Georgia GOP governor says he understands Trump's frustration, but maintains he's following state laws	
t3_jyi6td	Trump steps on Michigan lawmakers' message in tweets after meeting	
t3_jyzg9r	Rudy Giuliani says election case losses help Trump campaign’s strategy to get ‘expeditiously’ to Supreme Court	
t3_jyw4pb	Trump’s legal team cried vote fraud, but courts found none	
t3_jyt5rw	Liz Cheney says Trump should respect ‘sanctity’ of election if he can’t prove claims in court	
t3_jy9v9p	In Georgia, Pence Walks Line Between Trump's Election Falsehoods And GOP Senate Fight	
t3_jyl201	A vindictive Trump seeks to undermine Biden’s presidency	
t3_jyunps	Trump, laden with $400 million debts, plans to cash in on his post-presidency with a book deal, media appearances, and selling rally tickets, according to a report	
t3_jyuup3	Trump Wonders Why Joe Biden Is Forming A Cabinet In Latest Tweet Screed	
t3_jy6dsk	Two weeks after Biden named President-elect, Trump faces stinging setbacks	
t3_jyhjr0	Trump skips G20 coronavirus meeting to play golf and tweet bogus election claims	
t3_jyemqz	Donald Trump Will Lose One Of His Twitter Accounts To Joe Biden On Inauguration Day. An account the president uses to retweet his conspiracy theories and vitriol will be wiped and handed over to the Biden administration.	
t3_jygefw	Who needs Russia? Loudest attacks on US vote are from Trump	
t3_jyj7a6	Michigan Democrats are taking a stand against Trump's campaign to steal the state's vote	
t3_jysd13	Ben Carson Confirms Trump’s Friends Get Better Coronavirus Treatments	
t3_jygnzl	A group of Michigan voters are suing the Trump campaign for disenfranchising Black voters, lawsuit alleges	
t3_jyom7w	Recount off to a slow start, especially in Milwaukee where Trump campaign observers object to thousands of ballots, envelopes	
t3_jyyeac	Chris Christie Tears Into Trump's Legal Team: 'A National Embarrassment'	
t3_jya718	Blocked by Trump, Biden forced to use transition workarounds	
t3_jy2j68	Arizona’s largest county certifies Biden win over Trump	
t3_jyy0a9	Trump election challenges sound alarm among voters of color	
t3_jyo5jb	Pa. Sen. Toomey congratulates President-elect Joe Biden, calls on Trump to begin transition	
t3_jy94n0	Trump considers targeting birthright citizenship with executive order in his last weeks in office, report says	
t3_jy3a7r	After Trump meeting, Michigan GOP lawmakers affirmed Biden will win the state and urged Trump to focus on the COVID-19 pandemic currently ravaging the US	
t3_jyuup3	Trump Wonders Why Joe Biden Is Forming A Cabinet In Latest Tweet Screed	
t3_jyvp60	What lies ahead: After the damage of the Trump era, can America avoid disaster?	
t3_jycft4	The Memo: Trump plows ahead with efforts to overturn election	
t3_jyk5l1	The Desperate Final Gasps of Team Trump’s Flailing ‘Mini-Coup’	
t3_jyek1t	Trump’s last-ditch efforts to overturn results fail to make dent in Biden victory	
t3_jy3i78	Trump’s election legal strategy is all but doomed, but still could damage American democracy, experts say	
t3_jylq42	Trump Orders Hasty Afghanistan, Iraq Drawdowns to Beat Biden Inauguration	
t3_jyyvlv	Twitter Recognizes Biden as the Next @POTUS, Despite Trump's Denial	
t3_jz2hjq	Trump team making false argument about his 2016 transition	
t3_jygbaz	GOP Michigan ex-governor says state board will certify Biden winner over 'bully' Trump	
t3_jyww10	Trump administration pulls out of Open Skies Treaty with Russia	
t3_jype7k	Analysis: With silence, GOP enables Trump’s risky endgame	
t3_jxuc2q	Trump Is No Longer the Problem. His Army of Followers Is.	
t3_jywmds	Split-screen: Biden preps to be president, Trump fights for the job he is ignoring	
t3_jycgfg	Shame the Random, Unknown Government Officials Aiding Trump’s Coup Attempt	
t3_jygnh6	Here’s when Biden’s win becomes official — and how Trump is trying to prevent that | With key deadlines looming, derailing the certification of results is part of the president’s strategy	
t3_jyn27t	FDA authroizes emergency use of Regeneron antibody treatment given to Trump	
t3_jy2fn8	President-elect Joe Biden Asks Public to Fund Transition as Trump Refuses to Concede	
t3_jyiop6	Trump attacks big Pharma, announces programs to lower drug prices	
t3_jyserv	Pennsylvania GOP Sen. Pat Toomey Tells Trump It's Over, Congratulates Joe Biden	
t3_jyg34p	Trump Using Last Days to Lock in Policies and Make Biden’s Task More Difficult	
t3_jxi4lm	Senate GOP breaks 123-year tradition to pack courts with Trump’s judicial nominees in spite of loss. The latest judge approved by Mitch McConnell &amp; Co. is a 33-year-old lawyer who the Bar Assoc. rated “not qualified"	
t3_jyiov7	For Netanyahu and Israel, Trump’s Gifts Kept on Coming. Allowing the convicted spy Jonathan Pollard the ability to emigrate to Israel was just the latest in a long list of prizes for America’s closest ally in the Middle East.	
t3_jykt2t	Trump forges ahead with frantic effort to overturn election | Having exhausted many of his legal options, Trump is looking at other ways to subvert Joe Biden’s victory.	
t3_jyyjwi	Full Cramer: 'Past time to start a transition' but Trump still has a right to challenge	
t3_jxw71i	Trump's Stupid Coup—Which Hasn't Failed Yet—Is Distracting Us From What Needs to Be Done	
t3_jypr6w	The final days of lame-duck Trump: Electioneering, revenge and environmental attacks as the president refuses to go quietly	
t3_jz0akg	Trump, GOP’s ridiculous, flailing coup isn’t a joke. It’s a crime. There must be consequences | Will Bunch	
t3_jy3mhv	Biden's margin of victory over Trump surpasses 6 million votes	
t3_jyk59x	Wisconsin officials: Trump observers obstructing recount	
t3_jyi19h	Trump Is Staging a Comically Incompetent Coup — It would almost be possible to laugh at this debacle if the stakes weren’t so serious.	
t3_jxtnp8	People who know Rudy Giuliani are shocked by what he’s become. People who know Trump say he’s terrifed	
t3_jxyfjw	More conservatives break with Trump over election claims	
t3_jz227v	GOP Senator Has Instructed Staff to Cooperate With Biden Transition, Says It's 'Past Time' for Trump to Do Same	
t3_jy7n7y	Conservative News Site Warns Trump: 'Concede And Move On'	
t3_jy2mf4	Anger builds in Black community over Trump’s claims of voter fraud in big cities	
t3_jxnnin	Trump's extrajudicial attempt to 'stay in office' would have 'terrified most of the founders,' historian says	
t3_jy1p1c	Michigan lawmakers meet with Trump, say they haven't seen evidence of voter fraud	
t3_jxxp5g	A Trump official is still blocking Biden’s presidential transition. House Democrats want answers.	
t3_jyvt2z	Wisconsin officials: Trump observers obstructing recount | Election officials overseeing the recount of presidential votes in Wisconsin’s largest county are accusing observers for President Donald Trump of unduly slowing the process	
t3_jxva3c	Edward Norton Lays Out Trump's "Desperate Endgame" Using Metaphor of Failed Poker Hand — "The core of it is that he knows he’s in deep, multi-dimensional legal jeopardy and this defines his every action," says the actor.	
t3_jyjcxb	Wisconsin officials: Trump observers obstructing recount	
t3_jyc5ef	Trump options narrow as Michigan backs Biden win	
t3_jz22oq	Hogan ramps up criticism of Trump: 'Stop golfing and concede'	
t3_jyomso	GOP senator congratulates Biden, says Trump should accept results	
t3_jz3ay5	Trump slams global climate agreement that Biden intends to rejoin, during G20 speech | CBC News	
t3_jyufn4	Trump’s quest to overturn election runs into quiet resistance from local and state Republicans	
t3_jxtgbd	Trump’s press secretary Kayleigh McEnany heckled in briefing: ‘When will you admit you lost?’	
t3_jyca1s	The Trump campaign’s much-hyped affidavit features a big, glaring error	
t3_jyee44	Trump to lose @POTUS Twitter account on January 20	
t3_jyq2e5	Trump campaign requests recount in Georgia	
t3_jz3i4z	"Stop golfing and concede": Maryland GOP Governor Larry Hogan spars with Trump	
t3_jywmds	Split-screen: Biden preps to be president, Trump fights for the job he is ignoring	
t3_jxwqi6	'Call his bluff': Edward Norton lays out poker-style Trump analysis we never expected	
t3_jy5na8	Michigan Legislators Spurn Trump’s Bid to Overturn Election Results	
t3_jyhrl0	Trump skips G20 pandemic event to visit golf club as virus ravages US	
t3_jyp41a	Wisconsin election officials say Trump observers are obstructing the recount and interrupting vote counters	
t3_jywjti	40% of Top Pentagon Positions Empty After Donald Trump's Firing of Mark Esper	
t3_jyirvl	‘Do they just not care?’ Miami immigrants troubled by surge of Latino support for Trump	
