t3_jzpllg	The Already Useless Trump Kids Are About to Get Even More So	
t3_jz1a2t	Trump Lawyer Sidney Powell Says Georgia Election Lawsuit 'Will Be Biblical,' Suggests GOP Governor Helped Biden	
t3_jzwb0o	Sidney Powell Undermined Georgia GOP During Crucial Senate Runoff Before Trump Campaign Cut Her Loose	
t3_jyvps6	Judge's devastating question for team Trump	
t3_jz0eog	In Public, Trump Still Claims He Won. In Private, Aides Say He’s Planning for Life After Presidency.	
t3_jymexa	RNC Backs Trump's Bogus Claims That He Won the Election	
t3_jxwbg1	Trump accuses Pfizer and Moderna of working to stop his re-election	
t3_k033f1	Republican official: Trump efforts to undermine Georgia results could 'suppress the vote' in U.S. Senate runoff elections	
t3_jywjti	40% of Top Pentagon Positions Empty After Donald Trump's Firing of Mark Esper	
t3_jz5qcv	Brian Stelter Slams Lara Trump For Declaring Trump Voters Don’t ‘Feel’ That He Lost - “Facts do not care about your feelings,” the CNN host said.	
t3_jzwk4e	The Secret Service is reportedly preparing for Trump's 'post-presidency life'	
t3_k0f05j	How Trump's legal battles to overturn the election undermine the Black vote	
t3_jydzd2	Twitter says it will hand control of US president's official account to Joe Biden on January 20 - regardless of whether Donald Trump has left the White House	
t3_jz2tha	Trump obsession: Democrats tweet about him 12,569 times to 486 about Biden	
t3_jzu5pb	The Authors of the Dictator’s Handbook on What Trump Is Doing Wrong	
t3_jyqipn	Time is just not on Trump’s side to overturn 2020 election results	
t3_jzup8z	Trump Lawyers Plot Pennsylvania Last Stand as Michigan Certifies	
t3_jybaah	Rudy and Sidney’s Krakentastic Spectacle, and What It Could Mean -- A dismissive legacy media might have panned Team Trump’s press conference Thursday, but it was a significant moment with significant portents.	
t3_jzt2gz	Whoopi Goldberg blasts Republicans not speaking against Trump: 'This is an attempted coup'	
t3_jydzd2	Twitter says it will hand control of US president's official account to Joe Biden on January 20 - regardless of whether Donald Trump has left the White House	
t3_jz42uk	Trump’s legal team cried vote fraud, but courts found none	
t3_jzijpr	Trump Pulls Out Of Military Transparency Treaty With Russia, Europe	
t3_jzuphz	Trump goes out with a whimper and a tweet. It was always going to be that way	
t3_jz7fr3	Latest: Why a Federal Judge Tossed Out One of the Trump Campaign's PA Lawsuits	
t3_jzvflg	Pennsylvania counties certify election results despite isolated pushback and baseless fraud claims from Trump allies	
t3_jzt3hn	Drip by drip, U.S. Republicans edge away from Trump election claims	
t3_jz32ir	Larry Hogan to Trump: 'Stop golfing and concede' the election 'If you had done your job, America's governors wouldn't have been forced to fend for themselve,' Hogan said	
t3_jzpvbh	Rush Limbaugh criticizes Trump legal team for promising 'bombshells' and failing to deliver	
t3_jz8td4	Here are the 3 legal cases Trump may have to face once he’s no longer president	
t3_k0fixz	Is Trump's No Concession Endgame a "Stab-in-the-Back" Gambit Which Helped Bring the Nazis to Power?	
t3_jz0mm7	Bolton: 'Trump is throwing rocks through windows'	
t3_jzs06l	Michigan certifies Joe Biden's win despite Trump's GOP overtures | The Board of State Canvassers, which has two Republicans and two Democrats, confirmed the results on a 3-0 vote with one abstention	
t3_jzsrxm	General Motors abandons Trump in lawsuit fighting California on its own climate rules and vows to work on crisis with Biden	
t3_jzt28a	GM quits Trump lawsuit against California auto emissions rules	
t3_jx81g0	Donald Trump Called to Support Michigan Canvassing Board Members After Threats	
t3_jxxelw	Trump Appears To Doubting Tucker And Lets Him Touch The Fraudulent Ballots Himself	
t3_jxsoge	Biden campaign: Trump efforts to derail Michigan election results an 'abuse of office'	
t3_jylkfc	Wisconsin officials: Trump observers obstructing recount	
t3_jzoxch	What Donald Trump and Dick Cheney Got Wrong About America	
t3_jzp4fh	Is Trump Selling Tickets to His 2021 Inauguration?	
t3_jyzr2m	A Republican judge just tore into Trump’s election lawyers for their incompetence. Trump’s lawyers asked a judge to disenfranchise nearly 7 million voters. It ended badly for Trump.	
t3_jzqf5t	Republican Congressman Says GOP 'Embarrassing,' Calls on Party to 'Denounce' Trump's 'Conspiracy Theories'	
t3_jz2ofa	Miami Republicans won’t criticize baseless Trump claims of Venezuelan election rigging	
t3_jzicud	Here Comes the Biden Blame Game - If the double-dip recession hits next year, Biden will remind us over and over that it’s Donald Trump’s fault. He’ll be wrong.	
t3_jysta7	Trump camp's lawsuit struck down in Pennsylvania	
t3_jyjx9m	Romney vs. Chachi? Actor Scott Baio threatens to run against Utah senator in 2024 over Trump rebuke.	
t3_jybv6o	Will Trump Screw Up Republican Efforts to Hang Onto the Senate?	
t3_jz2dpu	Chris Christie calls the conduct of Trump’s legal team a ‘national embarrassment’	
t3_jzjzln	A Neighbor You Like Probably Voted For Trump	
t3_jxrbox	Republican Senator Lamar Alexander urges Trump to begin Biden transition	
t3_jzt2hb	Data: Trump's Anti-Globalism, Pro-Police Message Wins Over Hispanics	
t3_jxp52z	Tucker Carlson: Trump lawyer 'got angry' when pressed for evidence of voter fraud	
t3_jxx2eu	Nancy Pelosi calls Trump a 'Psychopathic Nut'	
t3_k0axg0	Rush Limbaugh: Trump’s Legal Team ‘Promised Blockbuster Stuff and Then Nothing Happened’	
t3_jyaufj	Berkeley professor sparks outrage by claiming Trump supporters who have an 'indifference' to COVID are like Germans who 'ignored and profited from the Holocaust'	
t3_k0bp1y	Election Aftermath: Either Or -- It is down to an “either or” situation: either President Trump prevails in his lawsuits and multiple constitutional paths to reelection, or Joe Biden and the Democrats succeed in stealing the election.	
t3_jzv3e2	With Michigan’s presidential vote certified, is Trump out of options?	
t3_jzdaid	Report: Maryland Gov. Larry Hogan, Anti-Trump Hero, Paid for Flawed Coronavirus Tests from South Korea	
t3_jzhelc	Mike Flynn Jr. adds twist to Trump team’s statement on Sidney Powell: ‘Give this the 24hr rule …’	
t3_jzszzy	Vladimir Putin wasted no time in weaponizing Trump's election conspiracies to spread Russian propaganda	
t3_k09pft	Pennsylvania Supreme Court rejects Trump campaign's effort to block counting certain absentee ballots	
t3_jz32ir	Larry Hogan to Trump: 'Stop golfing and concede' the election 'If you had done your job, America's governors wouldn't have been forced to fend for themselve,' Hogan said	
t3_jzhlu7	Trump's 'elite, strike force' legal team starts to shrink	
t3_jz2tha	Trump obsession: Democrats tweet about him 12,569 times to 486 about Biden	
t3_jy9hxd	Sidney Powell’s road from UNC to defending Trump’s supposed ‘landslide’ reelection	
t3_jz8xh4	Trump campaign to appeal dismissal of election lawsuit in Pennsylvania	
t3_jysdf1	Another defeat for Trump election claims	
t3_jyfrde	Senator Shirkey and Speaker Chatifeld’s names projected on Trump International Hotel	
t3_jyuhux	Trump campaign attorney responds to Pennsylvania ruling &amp; they’re grateful	
t3_jzrvao	Michigan votes to certify Biden's win over Trump	
t3_jzdr2f	Voting machines manufacturer on Trump conspiracy theory: ‘It’s not physically possible’	
t3_jzo4tp	Journalist Carl Bernstein names 21 GOP senators who 'privately expressed their disdain' for Trump	
t3_jy0jkm	Trump Is Still Raging Against Democracy. But It’s Time To Applaud The Tenacity Of Voters, Poll And USPS Workers	
t3_jzicmc	How Ronald Reagan’s Racism Helped Pave the Way for Donald Trump’s	
t3_jyc1ze	Voice of America's 5 Months Under Trump CEO: Lawsuits, Bias Claims, And A Sex Scandal	
t3_jzx3px	Trump probably won’t be the last politician to reject an election outcome without evidence	
t3_jy2icm	Donald Trump Jr. tests positive for COVID-19	
t3_jys1yc	Trump’s tyranny is the moral equivalent of treason	
t3_jzk79i	Former GOP Ohio Governor Says Republicans Are Either ‘Afraid’ or ‘in Complete Lockstep’ With Trump	
t3_k005l3	President Trump: "We are moving full speed ahead. Will never concede to fake ballots &amp; 'Dominion'"	
t3_jzhndd	Top confidant acknowledges Trump defeat: Country 'should move on' from election	
t3_k03h7b	Trump Push To Invalidate Votes In Heavily Black Cities Alarms Civil Rights Groups	
t3_jyzf5a	Hogan: Trump making US look like a 'banana republic'	
t3_jzt9d7	Trump’s Legal Team Tries (and Fails) to Disavow Conspiracy Theorist Attorney Sidney Powell: Unfortunately for Rudy Giuliani, Jenna Ellis, and the GOP, it’s not so easy to un-release The Kraken	
t3_jxwzgo	As Trump’s term ends, 40 percent of top DoD jobs lack confirmed officials	
t3_jzucnl	How Trump's tweets inadvertently mobilized hundreds of thousands suburban women against him	
t3_jzu0rh	Rush Limbaugh On Trump’s Legal Team: ‘They Promised Blockbuster Stuff And Then Nothing Happened’	
t3_jzfma9	The State Laws Governing Trump’s Power Grab in Michigan	
t3_jyp3ti	Trump Lawyers: Pennsylvania Lawsuit Dismissal Moves Us Closer to Supreme Court	
t3_jzsbmo	Michigan certifies Biden win; a setback for Trump challenge	
t3_jzmtno	Tucker Carlson was attacked by Trump supporters for questioning the outlandish claims of the president's lawyer Sidney Powell before she was fired	
t3_jz739w	Wisconsin Trump Campaign Lawyer Trying to Throw Out His Own Vote	
t3_jyyeac	Chris Christie Tears Into Trump's Legal Team: 'A National Embarrassment'	
t3_jyusgt	Ben Carson: Trump Saved My Life After I Got COVID	
t3_jzka2y	Pro-Trump Attorney Urges Republicans Not to Vote in Georgia Runoff	
t3_jzu0rh	Rush Limbaugh On Trump’s Legal Team: ‘They Promised Blockbuster Stuff And Then Nothing Happened’	
t3_jzk7yg	A Federal Judge Rejected Trump's Ludicrous Pennsylvania Case With Pure Disdain	
t3_jzpvd8	Trump's bizarro-world 'elite strike force' legal challenge is about to implode	
t3_jzrye4	Michigan votes to certify Biden's win over Trump	
t3_jz0nbc	Pressure grows from GOP for Trump to recognize Biden election win	
t3_jqky8p	r/pics censors its own community for calling out hypocritical disregard for covid after weeks of complaining about trump rallies	
t3_jzruwz	General Motors’ parting shot at Trump bodes well for the Biden presidency	
t3_k02ya3	Rachel Maddow Rings The Alarm On How Trump's 'Setting The Place On Fire' As He Leaves	
t3_jyf2se	Georgia GOP governor says he understands Trump's frustration, but maintains he's following state laws	
t3_k00eec	Exiting Trump puts dubious characters in top roles at Pentagon, NSA	
t3_jyxte1	Trump’s Legal Team Cried Voter Fraud, But Courts Found None	
t3_jz1up7	Trump Lawyer Says New Lawsuits Will Be Filed in Georgia Soon: 'Quite a Shock'	
t3_jznr6e	Trump 2024? Two-thirds of GOP voters want him to run for president again, poll says	
t3_jyrsd4	America is being subjected to a stress test – and Republicans are failing | Most elected Republicans are refusing to stand up to Trump. Their cowardice is one of the worst betrayals of public trust in the history of our republic	
t3_jzpxxu	Biden taps Blinken to reshape U.S. foreign policy in post-Trump era	
t3_jyz99e	Trump Lawyer Sidney Powell Promises 'Biblical' Lawsuit in Coming Days	
t3_jzmvum	Appeals Court Grants Expedited Review of Trump Campaign's Pennsylvania Lawsuit	
t3_k0ccte	Trump: Voters are '100% correct' that 2020 'election was stolen' -- Jenna Ellis: 'Media chatter of Joe Biden picking his cabinet is like fantasy football'	
t3_jzmj9c	Political Enemy List Trump Accountability Project Publicly Posted on Their Website	
t3_jyp2p0	Trump team requests recount of Georgia presidential vote	
t3_jzqca2	Trump scores two wins as Michigan legislature, federal appeals court agree to election reviews	
t3_jyvv5t	Trump team requests another recount of Georgia’s presidential race, a day after results certified in Joe Biden’s victory	
t3_jzwn09	2020 election results: Almost no Trump voters consider Biden the winner	
t3_jzjptq	Two-thirds of GOP voters support Trump running for president in 2024: survey	
t3_jztii3	Trump fears Giuliani, other lawyers in Biden vote challenge are ‘fools that are making him look bad’	
t3_jzsv52	Hunter Biden Arrives At White House Dressed As Turkey In Hopes Of Being Pardoned By Trump	
t3_jzwrvx	NYT reporter Maggie Haberman thinks Trump's tweet is 'the closest to a concession' he'll give	
t3_jz61e3	Former Ohio Gov. John Kasich Says GOP Is 'Afraid' Of Trump	
t3_k0eshp	Trump Appointee Unconstitutionally Interfered With VOA, Judge Rules	
t3_jz0vxg	Christie calls Trump's legal efforts a 'national embarrassment' as more Republicans speak out	
t3_jypjqa	Merkel's Germany Tells Trump Not to Bring Troops Home from Afghanistan	
t3_jz8bd8	Can American democracy survive Donald Trump?	
t3_k04qk9	Jon Ossoff Tries to Drive Wedge Between Georgia Trump Voters, GOP Senate Candidates Over Biden Win	
t3_jyzf5a	Hogan: Trump making US look like a 'banana republic'	
t3_jymhl2	Experimental drug given to Trump to treat covid-19 wins FDA clearance	
t3_jywf6n	Trump formally requests recount in Georgia	
t3_jytpjk	Pa. Senator Pat Toomey Says President Trump Has 'Exhausted All Plausible Legal Options'	
t3_jzx7gy	Rush Limbaugh knocks Trump's legal team: They promised 'bombshells' at press conference and 'nothing happened'	
t3_jyi47r	Trump Skips G20 Pandemic Preparedness Meeting as Covid-19 Cases Surpass 12 Million in US	
t3_jzzay5	Trump Won't Budge From Veto Threat Over Renaming Bases Honoring Confederates	
t3_jyfjr4	Trump Objects to Counting Thousands of Wisconsin Ballots	
t3_jzgode	Trump axed campaign lawyer Sidney Powell was because 'she was too conspiratorial even for him'	
t3_jzvws9	Trump previewed his legal strategy 2 years ago, when he said a turkey 'refused to concede and demanded a recount'	
t3_k0ccxp	When it comes to prosecuting Trump, let’s be selective	
t3_jy1cr9	Gregg Jarrett Has an Important Reminder for the Media About the Trump Campaign's Evidence of Voter Fraud	
t3_jy44lw	Trump Leads Voyage Of Pilgrims To Greenland To Establish Even Better America	
t3_jxxkww	Bernie Sanders says the 'GOP has ceased to be a political party' and 'is now a cult' for staying silent on Trump's election attacks	
t3_jzta4e	Trump Administration To Start Transition Process For Biden	
t3_jyl85p	Judge Dismisses Trump Campaign Suit to Invalidate PA Election Certification With Prejudice	
t3_jyhhtr	McEnany: Trump's path to victory is Supreme Court, exposing 'systemic' voter fraud	
t3_jyvrie	Trump's embarrassing, incompetent, humiliating, very sad coup	
t3_jy8kt6	Obama to produce Netflix series about Trump transition, unclear whether it will include abusing intel agencies to spy on successor	
t3_jzofom	Biden moves forward as GOP breaks with Trump rise	
t3_jzyror	Federal judge calls Trump suit argued by Rudy Giuliani "Frankenstein's Monster" and dismisses case	
t3_jyuofr	Judge rules against Trump global media chief after firings | A federal judge has ruled against the head of the agency that runs the Voice of America and other U.S.-funded news outlets who was accused of trying to turn it into a propaganda vehicle to promote President Donald Trump’s agenda	
t3_jztfqa	Trump Wars II: The Loser Strikes Back	
t3_jyvv5t	Trump team requests another recount of Georgia’s presidential race, a day after results certified in Joe Biden’s victory	
t3_k0hgs2	Facts Matter: Trump's Game Plan to Win	
t3_jx80n2	Trump Campaign Lawyers: There is a Pattern of Planned Voter Fraud in Multiple States	
t3_jyl85p	Judge Dismisses Trump Campaign Suit to Invalidate PA Election Certification With Prejudice	
t3_jzmus9	Donald Trump’s Bid to Steal the Election Hinges on a Shameless Homophobe Who Once Called Him a Lying, Idiotic Bully	
t3_jz1pj8	Mao’s Lesson for Trump’s America | Beware of leaders willing to set their own country on fire.	
t3_k07c8p	Trump bump: NYT and WaPo digital subscriptions tripled since 2016	
t3_jznypc	Trump campaign takes Pennsylvania election fight to federal appeals court	
t3_k02obo	Opinion | Guess Whose Votes Trump Doesn’t Want Counted	
t3_jyi4xi	Impeach the president again — Removal from office wouldn’t be the goal this time. It would be to prevent Trump from running again.	
t3_jzg091	Biden is stealing the spotlight. Trump can't stand it.	
t3_jy9p0n	Trump's defeat by Joe Biden has triggered a huge wave of relief among the United States' European allies	
t3_jzitza	Why The Left Can Be So Ridiculously Self-Righteous Without Realizing It -- What we saw in the lead up to the elections, and what we’ll witness for years to come, is utter contempt for Trump voters and conservatives in general.	
t3_k0f7st	Small but growing number of Republicans tell Trump it's over: "Stop golfing and concede"	
t3_jyx846	Sen. Toomey Congratulates Biden After Pennsylvania Judge Dismisses Trump Lawsuit	
t3_jzozd1	Why the Trump campaign’s big legal flameout in Pennsylvania seems like a turning point, even for Republicans	
t3_k089yi	'Malevolent travelers' coming if Trump's travel ban killed -- Biden has promised to eliminate executive order on 'Day 1'	
t3_jyek1t	Trump’s last-ditch efforts to overturn results fail to make dent in Biden victory	
t3_jz055a	Rep. Jeffries: Trump is in a massive meltdown right now	
t3_jxulhq	Once Out Of Office, Trump Faces Significant Legal Peril	
t3_jz22oq	Hogan ramps up criticism of Trump: 'Stop golfing and concede'	
t3_jyr204	Trump campaign files for new recount in Georgia	
t3_jz3i4z	"Stop golfing and concede": Maryland GOP Governor Larry Hogan spars with Trump	
t3_jzna59	New Trump rule may require some African tourists to pay up to $15,000 in bonds	
t3_jzrwf7	Indiana senators Braun and Young deny report they privately hold Trump in contempt	
t3_k0gldq	President Trump won?	
t3_jz54v1	Fifth GOP Senator congratulates Biden and Harris, says Trump has "exhausted all" Penn. legal options	
t3_k0f0zp	Watch Trump's Stock Market Collapse Prediction Go Down in Flames	
t3_k0eoay	'America is back': Biden pushes past Trump era with nominees	
t3_jyhrl0	Trump skips G20 pandemic event to visit golf club as virus ravages US	
t3_k05npo	Trump Is Still President, Even Though He’s Not Acting Like One | The federal government has essentially stopped functioning as a federal government.	
t3_jyzfzs	Chris Christie Says Trump's Legal Team Has Become a 'National Embarrassment'	
t3_jys1yc	Trump’s tyranny is the moral equivalent of treason	
t3_jy56dt	Trump Announces New Regulations Lowering Prescription Drug Costs	
t3_k08407	Pennsylvania certifies Biden win over Trump in state	
t3_jz6si6	Sidney Powell: Trump legal team disavows lawyer who claimed Venezuelan communists helped rig US election	
t3_jy9uv7	Trump's Futile Fight To Overturn Election Loss Breeds Turmoil, Risk	
t3_jz2mz3	Trump Campaign Didn’t Request a Recount in Wisconsin Counties Using Dominion Machines	
t3_jzyror	Federal judge calls Trump suit argued by Rudy Giuliani "Frankenstein's Monster" and dismisses case	
t3_jyvpw5	BREAKING: FDA Grants Emergency Use Authorization To Antibody Cocktail Used By Trump	
t3_jxx2eu	Nancy Pelosi calls Trump a 'Psychopathic Nut'	
t3_jygefw	Who needs Russia? Loudest attacks on US vote are from Trump	
t3_jyi1mt	Trump campaign "seeking to disenfranchise Black voters" with election fraud claims: lawsuit	
t3_jzomjx	Drip by drip, U.S. Republicans slowly break from Trump election claims	
t3_jye1kw	Justice Dept. meets Trump, Giuliani vote-fraud claims with silent skepticism	
t3_jzkul5	Trump: More Votes Than Voters in Key Swing States	
t3_jyy2z6	Bolton calls on GOP leadership to label Trump's behavior 'inexcusable'	
t3_k0826z	Trump’s Pentagon Now Vetting Nonpolitical Experts	
t3_jzo44d	Two years ago this week Trump was mocking a turkey for refusing to concede an election	
t3_jz3fxh	Claim that Trump 'was never given an orderly transition of power' is false	
t3_k08ewo	Brennan takes final shot at Trump: 'I leave his fate to our judicial system, his infamy to history, &amp; his legacy to a trash heap'	
t3_jzpdpe	Trump's election lawsuit leads to 3rd Circuit grant for expedited review	
t3_jz6p3p	‘Stop Golfing And Concede’ | Gov. Larry Hogan Hits Back At President Trump’s Tweet On South Korea COVID-19 Tests	
t3_jym2qo	Duty or Party? For Republicans, a Test of Whether to Enable Trump	
t3_jymov0	Trump Warns 'Massive Fraud' to Be Uncovered in Michigan Vote	
t3_jy0iwa	Twitter will hand @POTUS to Biden on Inauguration Day, even if Trump doesn’t concede	
t3_jz1z44	Top House conservative plots post-Trump GOP	
t3_jyd4va	Trump admits Michigan Congressmen met to discuss coup	
t3_jzvqda	Trump Lawyer Appears on Fox Touting ‘Promising’ Case in Pennsylvania After It’s Thrown Out by Judge	
t3_k056dg	John Brennan's breathless &amp;amp; dramatic thread bidding farewell to the president is met with calls for Trump to 'declassify everything'	
t3_jysta7	Trump camp's lawsuit struck down in Pennsylvania	
t3_jzjgop	Open Letter Calls on Harvard to Create 'System of Accountability' for Inviting Trump Admin Alums to Campus	
t3_jyunuj	Trump campaign adviser Steve Cortes: Sudden Stop In Mail-In Vote Count 'Suspicious' -- Particularly since it was followed by a "deluge" of votes for Joe Biden in key battleground states.	
t3_k04g1f	Why GOP Officeholders Tolerate Trump’s Election Antics	
t3_jytzv7	What Trump faces on Jan. 20, 2021	
t3_jyufn4	Trump’s quest to overturn election runs into quiet resistance from local and state Republicans	
t3_jyg71f	NAACP Federal Suit: Trump Violated Voting Rights Act	
t3_jzt627	Michigan's Board Of State Canvassers Certified Biden's Win In A Big Loss For Trump's Desperate Bid To Overturn The Election	
t3_jyaufj	Berkeley professor sparks outrage by claiming Trump supporters who have an 'indifference' to COVID are like Germans who 'ignored and profited from the Holocaust'	
t3_jz2622	Trump’s overarching Middle East strategy reaches a disastrous dead end	
t3_k063d1	The Real Reason Trump’s Lawsuits Disproportionately Target Black and Latino Voters	
t3_jyj43l	Michigan Group Sues Trump for Disenfranchising Black Voters	
t3_jytan4	Detroit voters sue President Trump over his attempt to block certification of election results	
t3_jyxodl	U.S. courts find no voter fraud despite cries from Trump’s legal team	
t3_k00ahk	Trump says he ‘will never concede’ and transition process has nothing to do with election result	
t3_jzexf7	Trump’s gains in North Philly show Latino voters are not a ‘gimme’ for Democrats	
t3_jzgefs	Blackstone CEO Stephen Schwarzman says Trump lost	
t3_jznr0d	Appeals Court Grants Expedited Review of Trump Campaign's Pennsylvania Lawsuit	
t3_jzbb0y	Reporter Carl Bernstein names 21 GOP senators who 'repeatedly expressed extreme contempt for Trump'	
t3_jy5na8	Michigan Legislators Spurn Trump’s Bid to Overturn Election Results	
t3_jzc781	John Kasich calls Trump's refusal to concede 'absurd'	
t3_jxib3j	Trump Campaign Advisor Boris Epshteyn: Reporters 'Taken Aback' by Evidence Presented By Trump's Lawyers	
t3_k03bun	Trump's awkward exit leaves behind a big problem	
t3_jzwgzq	Rush Limbaugh, Michigan, GSA hammer nails into coffin of Trump's election fraud claims	
t3_jyvp60	What lies ahead: After the damage of the Trump era, can America avoid disaster?	
t3_jpbun7	Multiple reports claim if Trump loses, he is considering launching a "Trump TV" to fight Fox News, and plans to take Sean Hannity, Tucker Carlson, Laura Ingraham and others with him.	
t3_jzrzv8	Rush Limbaugh Knocks Trump's Lawyers For Not Providing Voter Fraud Proof	
t3_jz2dpu	Chris Christie calls the conduct of Trump’s legal team a ‘national embarrassment’	
t3_k0f7cb	Defenders of US Public Schools Call on Biden to Ditch Trump's Disastrous Education Policies—and Obama's Too	
t3_jzsfv2	Obama calls Trump era an 'anomaly' in Canada-U.S. relations	
t3_jyp41a	Wisconsin election officials say Trump observers are obstructing the recount and interrupting vote counters	
t3_jzmam7	Trump's top election lawyer in Wisconsin says he and his wife voted illegally in the campaign's latest legal argument	
t3_k0dlm3	Pennsylvania, Nevada certify election results for Biden despite Trump legal challenges	
t3_jz8wcb	Dominion rep responds to Trump campaign claims in Fox News interview: 'Physically impossible' to switch votes	
t3_k01msh	Secret Service planning for Trump spending lots of his post-presidency in Palm Beach	
t3_jz6si6	Sidney Powell: Trump legal team disavows lawyer who claimed Venezuelan communists helped rig US election	
t3_k0g41t	YouTube suspends One America News, a Trump favorite, for peddling pandemic misinformation	
t3_jzvxtn	It’s time Republicans put country over Trump’s injured ego	
t3_jyzjg9	Congresswoman Liz Cheney is the latest Republican calling on Trump to prove fraud claims in court	
t3_jzdrjr	Trump goes golfing as concession pressure grows	
t3_jz0akg	Trump, GOP’s ridiculous, flailing coup isn’t a joke. It’s a crime. There must be consequences | Will Bunch	
t3_jzpeei	Trump Is Blowing Up the Georgia GOP—and It Couldn’t Happen at a Better Time	
t3_jyvpw5	BREAKING: FDA Grants Emergency Use Authorization To Antibody Cocktail Used By Trump	
t3_k0ahv4	Judge Emmet Sullivan Will Oversee Voting Rights Act Case Accusing Trump of Anti-Black Campaign to Overturn Election	
t3_k0cb1h	Hawley 2024? Missouri Republican could be ‘Trump 2.0,’ say conservative supporters	
t3_jy38k5	CNN's Brianna Keilar rolls the tape on Donald Trump's history of baselessly claiming election fraud	
t3_jyulqn	Trump Team Files for Fresh Recount in Georgia’s Presidential Race	
