t3_jzj8y9	Republican pollster: Trump's false 'rigged' election claims may hurt GOP chances of keeping Senate	
t3_jztt46	“Let’s Buy Trump Off So He Shuts the F--k Up”: Will Rupert Murdoch Spring for a Post-Presidential Fox Gig?	
t3_k06bmj	Trump Mocked After Telling GOP to Listen to Randy Quaid's Election Demand	
t3_jz5fzn	Federal judge dismisses Trump campaign’s Pennsylvania case	
t3_k0e1gu	Kemp decries ‘baseless attacks’ from Trump supporter	
t3_jzm6f8	Carl Bernstein names 21 GOP senators who privately express “contempt” for Trump but still enable him	
t3_jygnzl	A group of Michigan voters are suing the Trump campaign for disenfranchising Black voters, lawsuit alleges	
t3_jyjte3	Ilhan Omar Urges Biden to ‘Reverse’ President Trump’s Middle East Agreements -- Thinks that peace between Israel and Arab nations is a bad thing.	
t3_jzprxe	Trump’s Absurd ‘You Did It First’ Argument for Stealing the Election	
t3_jz0b6y	Claim that Trump 'was never given an orderly transition of power' is false	
t3_jywmds	Split-screen: Biden preps to be president, Trump fights for the job he is ignoring	
t3_jyobrs	On Parler, a pro-Trump call for Georgia runoff boycott threatens Mitch McConnell's plan to restrain Biden	
t3_jyy5dt	Facebook, Instagram Will Switch White House Accounts From Trump to Biden on Jan. 20	
t3_jz0b53	Trump tells G-20 world leaders that Paris climate accord was 'designed to kill the American economy'	
t3_jzobu4	Behind the scenes, Trump frustrated with his legal team's maneuvers	
t3_k0ape6	Newsmax CEO Thinks Trump Should Concede When States Certify Elections, Would Support Overturning Electoral College	
t3_jzverf	Trump’s Case is a Constitutional One, Sidney Powell's is a Criminal One	
t3_jz1z65	‘Stop golfing and concede’: Trump and Maryland Gov. Hogan spar again after president criticizes South Korean tests	
t3_jzvs4f	Trump Tells GSA, and His Team, to Begin the Transition Process; Vows to ‘Keep Up the Good Fight’	
t3_jzhelc	Mike Flynn Jr. adds twist to Trump team’s statement on Sidney Powell: ‘Give this the 24hr rule …’	
t3_jyoyk0	U.S. judge calls Trump claim challenging Biden win in Pennsylvania 'Frankenstein's Monster'	
t3_jyi6gg	With Trump victory in Florida, the state turned a deeper red. What does it mean for future elections?	
t3_jybnek	Trump tries to drum out GOP election officials who won’t play his games — Georgia Secretary of State Brad Raffensperger's family has received threats and he expects a primary challenge in 2022	
t3_jy0iwa	Twitter will hand @POTUS to Biden on Inauguration Day, even if Trump doesn’t concede	
t3_jyx75d	House Democratic Caucus chairman: Trump's presidency was a 'scam'	
t3_jzomjx	Drip by drip, U.S. Republicans slowly break from Trump election claims	
t3_k03hse	Trump campaign loses 5 more election cases in Pennsylvania	
t3_jyjecp	Wisconsin officials: Trump observers obstructing recount	
t3_jyrnnk	Trump's attempt to steal the election unravels as coronavirus cases surge	
t3_jxraf0	While You Were Focused on The Kraken, the Senate Continued Confirming Trump Federal Judges	
t3_jzjyaw	Trump EPA removes tool states use to protect farmworkers, environment	
t3_k0hdca	Trump team wins hearings in Arizona, Michigan and Pennsylvania legislatures on election concerns	
t3_jy38ap	Biden will receive @POTUS Twitter account on Jan. 20 even if Trump doesn't concede, company says	
t3_jzquzq	GOP senator: No indication of widespread voting irregularities, window for Trump challenges is 'closing'	
t3_jy3a7r	After Trump meeting, Michigan GOP lawmakers affirmed Biden will win the state and urged Trump to focus on the COVID-19 pandemic currently ravaging the US	
t3_k01ja2	Alan Dershowitz Says Trump Still Has ‘Two or Three Constitutional Paths’ To A 2020 Victory – But He Hasn’t Seen The Evidence To Overturn	
t3_jydj00	LIVE: March for Trump in Atlanta, Georgia	
t3_jz1z44	Top House conservative plots post-Trump GOP	
t3_jyzx62	Trump faces pressure from Republicans to drop 'corrosive' fight to overturn election	
t3_jygabf	Ilhan Omar Urges Biden To ‘Reverse’ President Trump’s Middle East Agreements	
t3_jz3ygy	Refusing to concede, Trump pushes for another recount in Georgia	
t3_jyvrie	Trump's embarrassing, incompetent, humiliating, very sad coup	
t3_k05npo	Trump Is Still President, Even Though He’s Not Acting Like One | The federal government has essentially stopped functioning as a federal government.	
t3_jzjii3	Mark Levin: Letting Trump's legal efforts play out far better than 'what the Democrats are doing to our institutions'	
t3_k0b15p	Trump-Appointed Judge Ensures That Lin Wood’s Bizarre Subpoena of the Atlanta Hawks Won’t Go Anywhere	
t3_jzsv52	Hunter Biden Arrives At White House Dressed As Turkey In Hopes Of Being Pardoned By Trump	
t3_jzji16	Trump's closest business ally just admitted that the president lost the election	
t3_k0as5g	Judge rebukes another frivolous Trump lawsuit, allowing Pennsylvania to certify results	
t3_jzu2rx	Michigan Certifies Election Results, Declaring Biden Winner In New Blow To Trump	
t3_jpg7em	‘Trumpism Is Going To Be Here For Quite Some Time’: Andrew Yang Says Dems Need To Work On Appeal To Working Class	
t3_jzc3y4	More Republicans are losing patience with Trump's legal absurdities	
t3_jzlcxd	Trump Could Push Don Jr. and Ivanka in 2024, but Trumpism Is a Hard Sell Without Him	
t3_jy1csd	Hispanic Voters in Florida Feel Election Was Stolen from Trump	
t3_jyc40v	With Trump sabotaging American democracy, the Russians don’t need to interfere	
t3_k0eshp	Trump Appointee Unconstitutionally Interfered With VOA, Judge Rules	
t3_jzwige	PA Supreme Court rejects Trump challenge to absentee ballots in Allegheny County	
t3_jzvx08	NYPD planning to reduce police presence, congestion around Trump Tower: Sources tell ABC News	
t3_jz8ss3	Trump May Announce His 2024 Bid Before Year’s End	
t3_jzsfbe	Trump attorney in Wisconsin argues absentee votes should be thrown out - including his own	
t3_jz2pci	Tapper: Judges are running out of pejoratives for Trump's legal efforts - CNN Video	
t3_jz9dqx	Lou Dobbs Warns the GOP: Republican Party ‘Will Be Gone and Done’ If They Don’t Stand With President Trump	
t3_jzi8g6	Trump’s legal team’s statement on Sydney Powell was made to focus on the upcoming Supreme Court case. There are two separate legal pathways. One on equal protection and PA voting rules (most important right now). The second is Dominion software which will take longer.	
t3_jzw53r	See It: Whoopi Goldberg calls Trump a wannabe dictator and berates him for ‘attempted coup’	
t3_jzke5q	Interior Department contender says Biden would target Trump Arctic drilling push on first day	
t3_jzpy16	On Trump, GOP's silence 'can't be excused and won't be forgiven' — For the first time, a corrupt US leader is trying to cling to power through autocratic means. Let history note who lacked the patriotism to speak up.	
t3_k0ccte	Trump: Voters are '100% correct' that 2020 'election was stolen' -- Jenna Ellis: 'Media chatter of Joe Biden picking his cabinet is like fantasy football'	
t3_k04vzj	Trump’s dam finally breaks. But we cannot go through this again.	
t3_jznr0d	Appeals Court Grants Expedited Review of Trump Campaign's Pennsylvania Lawsuit	
t3_k0c7j8	Chris Evans, Zach Braff Want A List Of ‘Trump Enablers’	
t3_jzpeei	Trump Is Blowing Up the Georgia GOP—and It Couldn’t Happen at a Better Time	
t3_jzbvkj	Trump aims to box in Biden abroad, but it may not work	
t3_jziow1	Facebook will give presidential accounts to Biden even if Trump refuses to concede election	
t3_jy0pv9	Chris Evans and Zach Braff Encourage Keeping Track of Trump ‘Enablers’	
t3_jzjlmh	Democrat House Losses Stemmed From Trump Increasing Voter Turnout: Rep. Richmond	
t3_jzguka	Trump handing Taliban a victory on his way out, says former national security adviser H.R McMaster	
t3_jzbb0y	Reporter Carl Bernstein names 21 GOP senators who 'repeatedly expressed extreme contempt for Trump'	
t3_jzsjpm	Trump is reportedly worried that his legal team is made up of 'fools that are making him look bad'	
t3_jy2icm	Donald Trump Jr. tests positive for COVID-19	
t3_jyzjov	Chris Christie dismissed Trump's legal team as 'a national embarrassment'	
t3_jzpuu9	Election officials are facing death threats in key swing states where Trump is trying to overturn the results of the 2020 presidential race	
t3_jyyf6p	'Unacceptable': Wisconsin Election Officials Say Trump Observers Hindering Recount With Constant Interruptions, Questions	
t3_jyyf6p	'Unacceptable': Wisconsin Election Officials Say Trump Observers Hindering Recount With Constant Interruptions, Questions	
t3_jzsmiy	Trump Fires Sidney Powell for Election Conspiracies as Though He’s Not About to Claim China Paid Poll Workers to Change All the Ballots to Biden	
t3_jxem59	When Proven Liars Say Trump's Chances Are Slim, It's Time to Listen to Honest Folk Who Know the Score Instead	
t3_jyyvlv	Twitter Recognizes Biden as the Next @POTUS, Despite Trump's Denial	
t3_jxp42s	Mitt Romney issues scathing statement condemning President Trump's voter fraud claims	
t3_jytj5f	Trump or No Trump, Religious Authoritarianism Is Here to Stay	
t3_k0exmu	For Trump, it’s all over but the tweeting	
t3_jxnw1z	Atlanta Mayor Suggests Trump Would ‘Eat His Own Children’ To Advance Agenda	
t3_jyxodl	U.S. courts find no voter fraud despite cries from Trump’s legal team	
t3_jz2tha	Trump obsession: Democrats tweet about him 12,569 times to 486 about Biden	
t3_jzhbcz	The Death Star Strategy: Is Trump Contemplating The Ultimate Constitutional Trick Shot?	
t3_jxoy8t	Trump and Giuliani are the Republican Party	
t3_jytan4	Detroit voters sue President Trump over his attempt to block certification of election results	
t3_jz7cgh	Trump dumps Sydney Powell, lawyer who promised to "blow up" Georgia, as legal strategy unravels	
t3_jyqoj0	Dr. Ben Carson: Trump Saved My Life After I Got COVID	
t3_jyuhux	Trump campaign attorney responds to Pennsylvania ruling &amp; they’re grateful	
t3_k0flpb	Hunter Biden Arrives At White House Dressed As Turkey In Hopes Of Being Pardoned By Trump	
t3_jze8d0	Transition warning: Trump's mental illness is a growing danger	
t3_k0dbia	Trump probably can't pardon himself. He may still try	
t3_jygoog	Trump voters back the President’s charges of election fraud led by Democrats	
t3_jzlcxd	Trump Could Push Don Jr. and Ivanka in 2024, but Trumpism Is a Hard Sell Without Him	
t3_jyjte3	Ilhan Omar Urges Biden to ‘Reverse’ President Trump’s Middle East Agreements -- Thinks that peace between Israel and Arab nations is a bad thing.	
t3_k0d4ji	Pro-Trump Congressman Called Out for Claiming in Lawsuit That He Was Harmed by Winning Election	
t3_jyi5ye	Trump goes golfing in middle of G20 summit	
t3_jykdgu	Trump denies Georgia's results after hand recount; prompts concerns over January's Senate runoff	
t3_jzgsx3	Trump legal team says Sidney Powell had no formal role, but record shows they loved her involvement	
t3_jxxiya	Trump refuses to take questions after falsely claiming he won election in first media appearance in weeks. No sitting US president has falsely claimed an election victory from the Brady Briefing Room. Until Friday	
t3_jywgwe	Republican senator congratulates Biden telling Trump to ‘accept outcome of election’	
t3_jo5p8t	Trump declaring the election over	
t3_jyacke	Rudy Giuliani's quixotic frenzy has observers wondering if he may need Trump's protection | "One explanation? He needs a pardon and he's trying to earn it," a CNN analyst says	
t3_jyht3y	Pompeo’s Grotesque Farewell Party in Israel Shows That the Trump Team Knows It's Over — Pompeo used his visit to Israel and the settlements to push forward his pet ideological project and advance his post-Trump political career.	
t3_jznpy5	Trump set on veto of defense bill over renaming bases honoring Confederates	
t3_jzoxch	What Donald Trump and Dick Cheney Got Wrong About America	
t3_jyzx62	Trump faces pressure from Republicans to drop 'corrosive' fight to overturn election	
t3_k0cdoc	Trump ignores reporter’s question about trying to pardon himself after doing so for turkey	
t3_jztvos	Megathread: The GSA Has Informed President-Elect Joe Biden that the Administration is Ready to Begin the Formal Transition Process	
t3_jyyjwi	Full Cramer: 'Past time to start a transition' but Trump still has a right to challenge	
t3_jxgnco	Tucker Carlson Unloads On Trump Lawyer Sidney Powell Over Wild Election Claims: The Truth Matters	
t3_jz37gc	Trump Derangement Syndrome in Democrats won't go away with Trump	
t3_jzq2wb	Sidney Powell responds to Trump Campaign legal statement with agreement but an “epic” lawsuit is still coming this week	
t3_jyy5dt	Facebook, Instagram Will Switch White House Accounts From Trump to Biden on Jan. 20	
t3_jxgzoc	Trump campaign statement on Georgia	
t3_jz5oyu	Trump campaign says Sidney Powell not a member of legal team	
t3_jzy84b	Midtown Trump Tower To Have Reduced Security After President Leaves Office in January	
t3_jzv4mr	The post-Trump politics of Covid	
t3_jxi4lm	Senate GOP breaks 123-year tradition to pack courts with Trump’s judicial nominees in spite of loss. The latest judge approved by Mitch McConnell &amp; Co. is a 33-year-old lawyer who the Bar Assoc. rated “not qualified"	
t3_jywjti	40% of Top Pentagon Positions Empty After Donald Trump's Firing of Mark Esper	
t3_k04a0b	Rush Limbaugh Criticizes Trump Campaign for Hyping Up 'Blockbuster' Voter Fraud Evidence: 'Nothing Happened… Not Good'	
t3_jzj73m	Trump’s press secretary Kayleigh McEnany heckled in briefing: ‘When will you admit you lost?’	
t3_k0ex0g	Dominion Executive: Trump is not going to win. I made f***ing sure of that.	
t3_jy38ap	Biden will receive @POTUS Twitter account on Jan. 20 even if Trump doesn't concede, company says	
t3_jzrwf7	Indiana senators Braun and Young deny report they privately hold Trump in contempt	
t3_jz4v45	Longtime diplomat says Trump conspiracies hurt U.S. more than Russia, China	
t3_jzv84v	New Trump rule may require some African tourists to pay up to $15,000 in bonds	
t3_jzbqm7	Trump campaign demands recount, signature matching in Georgia	
t3_jzqrab	Poll: Americans Want Biden to Stay Out of Trump Investigations &amp; Pass on Progressive Policies for Now	
t3_jxsifm	Biden lawyer says there's "no chance" that Trump's "pathetic" Electoral College effort works	
t3_jzazcu	Maryland governor says Trump should concede election, stop golfing	
t3_k0gwju	This Political Theorist Predicted the Rise of Trumpism. His Name Was Hunter S. Thompson	
t3_jz0b6y	Claim that Trump 'was never given an orderly transition of power' is false	
t3_jykyw7	Federal Election Commission Chair: Trump Campaign Has Legitimate Claims of Election Fraud	
t3_jzntsc	GOP Former National Security Officials Urge Party to Demand Trump Concession	
t3_jyv0um	FDA Grants Emergency Use Authorization To Antibody Cocktail Used By Trump	
t3_jyzpvt	How Trump Responded When Liz Cheney Called on Him to Concede: "Sorry Liz, can’t accept the results of an election with hundreds of thousands of fraudulent votes cast, enough to easily flip the Election. You’re just unhappy that I’m bringing the troops back home where they belong!"	
t3_jy21wp	Amid Wisconsin recount, Trump campaign tried to have thousands of ballots tossed	
t3_jyrsd4	America is being subjected to a stress test – and Republicans are failing | Most elected Republicans are refusing to stand up to Trump. Their cowardice is one of the worst betrayals of public trust in the history of our republic	
t3_jz5fzn	Federal judge dismisses Trump campaign’s Pennsylvania case	
t3_k05hus	Donald Trump Backing Don Jr. or Ivanka for 2024 Is Fine by Republicans—but They Prefer Mike Pence	
t3_jygabf	Ilhan Omar Urges Biden To ‘Reverse’ President Trump’s Middle East Agreements	
t3_jztt46	“Let’s Buy Trump Off So He Shuts the F--k Up”: Will Rupert Murdoch Spring for a Post-Presidential Fox Gig?	
t3_jz6gek	Trump campaign cuts Sidney Powell from president’s legal team - The abrupt shake-up comes as Powell makes far-fetched and unsupported claims of voter fraud in the 2020 elections.	
t3_jzuuec	Biden team wants to understand Trump effort to 'hollow out government agencies'	
t3_jzk79i	Former GOP Ohio Governor Says Republicans Are Either ‘Afraid’ or ‘in Complete Lockstep’ With Trump	
t3_jzqca2	Trump scores two wins as Michigan legislature, federal appeals court agree to election reviews	
t3_jy9asn	Let's count the ways Donald Trump has tried to subvert this election, shall we?	
t3_jzrztf	CEOs Urge Trump To Concede: 'Not A Moment To Waste' In Fighting COVID-19	
t3_jy1qop	After Trump meeting, Michigan GOP leaders say Biden's win still stands	
t3_k0f9d4	'Well that was weird as s***': Reporters caught on hot mic baffled by Trump's minute long press conference | The president previously warned voters that the stock market would tank if Joe Biden won the election	
t3_jyhhtr	McEnany: Trump's path to victory is Supreme Court, exposing 'systemic' voter fraud	
t3_jzjhoa	Republican former national security officials urge party to demand Trump concession	
t3_k056dg	John Brennan's breathless &amp;amp; dramatic thread bidding farewell to the president is met with calls for Trump to 'declassify everything'	
t3_jy96f8	Shields and Brooks on the danger of Trump’s refusal to concede	
t3_jzgz98	John Kasich Stunned GOP Isn’t Defending Democracy Against Trump	
t3_jyp3ti	Trump Lawyers: Pennsylvania Lawsuit Dismissal Moves Us Closer to Supreme Court	
t3_jzebvu	Trump’s fundraising emails give spam a bad name - The election is over, but Trump's campaign is still bombarding his supporters with conspiracy-mongering demands for more money. Its exhausting.	
t3_jz9j48	Kasich: Republicans 'either in complete lockstep' or 'afraid' of Trump	
t3_jynjyq	Wisconsin officials: Trump observers obstructing recount	
t3_jyufn4	Trump’s quest to overturn election runs into quiet resistance from local and state Republicans	
t3_jq19e7	Discussion: AP Calls Election for Biden	
t3_jzofom	Biden moves forward as GOP breaks with Trump rise	
t3_jzqpbm	Rush Limbaugh criticizes Trump legal team for promising 'bombshells' and failing to deliver	
t3_jzfqzc	Do Trump-Supporters Live in an Alternate Universe? Actually a huge number of Americans have a false impression of reality because they are being told lies by their media. The people who constantly hear these lies do live in an "alternate reality."	
t3_jyk8mk	‘My Frustration Turned Into Anger.’ Some Americans Who Lost Family Members to COVID-19 Have Turned Against Donald Trump	
t3_jyobi4	Michigan Legislators Face Calls For Possible Criminal Charges After Meeting With President Trump On Certification	
t3_jyhsxr	Brian Williams mocks Geraldo Rivera suggestion to name COVID-19 vaccine after Trump	
t3_jz73xa	Judge Dismisses Trump Campaign's Bid To Delay Vote Certification In Pennsylvania	
t3_jym9cn	Pennsylvania Judge Dismisses Trump Campaign's Challenge to Pennsylvania Election Law	
t3_jznr0d	Appeals Court Grants Expedited Review of Trump Campaign's Pennsylvania Lawsuit	
t3_jyi6td	Trump steps on Michigan lawmakers' message in tweets after meeting	
t3_jynp3x	Trump Orders Hasty Afghanistan, Iraq Drawdowns to Beat Biden Inauguration	
t3_jz3ay5	Trump slams global climate agreement that Biden intends to rejoin, during G20 speech | CBC News	
t3_k0ae8g	Trump Loyalist is the leader of the Pentagon Transition	
t3_jxzw8k	Donald Trump: ‘Big Pharma’ Purposely Delayed Coronavirus Vaccine Until After Election	
t3_jxyoqs	The Perils of Not Prosecuting Trump Joe Biden is wary of a legal reckoning against his predecessor, but to let Trump go would be to sanction future corruption.	
t3_jz37gc	Trump Derangement Syndrome in Democrats won't go away with Trump	
t3_jyulqn	Trump Team Files for Fresh Recount in Georgia’s Presidential Race	
t3_jzseje	National Security Experts Urge Republicans To Demand Trump Concede The Election	
