t3_k0bsrn	Ivanka Trump called out for boasting about drop in greenhouse emissions: "This is largely because of the pandemic"	
t3_jzpd7w	JUST IN: Third Circuit Court of Appeals Grants Expedited Review For Team Trump’s Appeal in Pennsylvania	
t3_jzqpbm	Rush Limbaugh criticizes Trump legal team for promising 'bombshells' and failing to deliver	
t3_jz3tl3	Michael J. Fox says Donald Trump has played on 'every worst instinct in mankind': 'Biff is president!'	
t3_jyfd5c	I met ‘monster’ reality TV star Donald Trump 16 years ago. The reality of him has been monstrous . . .	
t3_jyj6r2	Judge rules against Trump global media chief after firings	
t3_k01u5c	Trump campaign legal team distances itself from Powell	
t3_k04vjz	Why Newsmax Supports Trump’s False Voter-Fraud Claims	
t3_k0ammd	Nevada Supreme Court Certifies Biden’s Victory Over Trump	
t3_jz1j0x	Chris Christie: Trump’s Legal Team Has Been a ‘National Embarrassment’	
t3_jz5fzn	Federal judge dismisses Trump campaign’s Pennsylvania case	
t3_jyeldv	A new lawsuit alleges Trump’s effort to overturn Michigan’s election results disenfranchises Black voters	
t3_jxr19z	Senate GOP Shatters 123-Year Tradition to Approve Even More Trump Judges	
t3_jyl5yg	Donald Trump Is Leaving Behind Blueprints to End Democracy - And I fear there’s no going back	
t3_jxo7we	New York officials are now said to be investigating some of Trump's tax write-offs, including consulting fees that appeared to go to his daughter Ivanka	
t3_jy248u	Anti-Trump Legal Team Withdraws In Pennsylvania	
t3_k0dv2v	'WJ Live': The Viral Memo Changing the Trump Legal Strategy	
t3_jzvxtn	It’s time Republicans put country over Trump’s injured ego	
t3_jznypc	Trump campaign takes Pennsylvania election fight to federal appeals court	
t3_jyvt2z	Wisconsin officials: Trump observers obstructing recount | Election officials overseeing the recount of presidential votes in Wisconsin’s largest county are accusing observers for President Donald Trump of unduly slowing the process	
t3_jxuleo	It’s time for everyone to pick a side: America or President Trump	
t3_jz8bvm	Native American voters across Minnesota turned out to oust Trump - Vote totals were up around Red Lake, and 90% for Biden	
t3_jyz8b3	For U.S. election officials certifying results, Trump's refusal to concede has chilling consequences	
t3_k02ya3	Rachel Maddow Rings The Alarm On How Trump's 'Setting The Place On Fire' As He Leaves	
t3_jz0b6y	Claim that Trump 'was never given an orderly transition of power' is false	
t3_jzpuu9	Election officials are facing death threats in key swing states where Trump is trying to overturn the results of the 2020 presidential race	
t3_jz7frn	Trump Campaign Formally Requests a Recount in Georgia	
t3_jyi6td	Trump steps on Michigan lawmakers' message in tweets after meeting	
t3_jzmfmo	President Trump Wanted a Supreme Court Election Battle. His Current Appeal Simply Cannot Get Him There.	
t3_jzeqq0	Opinion | Why Biden should stop parsing words and call Trump's lies a coup	
t3_jzebvu	Trump’s fundraising emails give spam a bad name - The election is over, but Trump's campaign is still bombarding his supporters with conspiracy-mongering demands for more money. Its exhausting.	
t3_jyfjr4	Trump Objects to Counting Thousands of Wisconsin Ballots	
t3_jztemd	Hear Rush Limbaugh criticize Donald Trump's legal team	
t3_k07tg5	Sidney Powell responds after Trump campaign says she is not part of legal team: '#KrakenOnSteroids'	
t3_jz9j48	Kasich: Republicans 'either in complete lockstep' or 'afraid' of Trump	
t3_jzc781	John Kasich calls Trump's refusal to concede 'absurd'	
t3_jybdhg	Why Kemp formalized Georgia’s election despite Trump’s pushback	
t3_k07cr0	Trump administration to reportedly dispose of Open Skies treaty planes	
t3_jypw7q	Out of 53 Republican senators, only two have stood up to Trump's attempt to overturn the election	
t3_jzsxow	Trump Lawyer: Michigan Legislature Agrees to Hold Election Review Hearings	
t3_jz071b	‘National Embarrassment’: Christie Blasts Trump’s Legal Team As Election Challenges Fizzle	
t3_jzup8z	Trump Lawyers Plot Pennsylvania Last Stand as Michigan Certifies	
t3_jz404d	Team Trump offering 'fire hose' of conspiracy Kool-Aid for supporters	
t3_jyvpw5	BREAKING: FDA Grants Emergency Use Authorization To Antibody Cocktail Used By Trump	
t3_jyp7pw	Judge Dismisses Trump Campaign’s Pennsylvania Lawsuit, Slams ‘Strained’ Reasoning; This only helps these cases reach higher levels of court because signed affidavits are admissible in court	
t3_jz227v	GOP Senator Has Instructed Staff to Cooperate With Biden Transition, Says It's 'Past Time' for Trump to Do Same	
t3_jz3bhq	Pennsylvania election: Trump appeals dismissal of bid to block vote certification	
t3_jzv3e2	With Michigan’s presidential vote certified, is Trump out of options?	
t3_k00bnt	Trump’s legacy may be an increasingly authoritarian Republican Party	
t3_jzkul5	Trump: More Votes Than Voters in Key Swing States	
t3_k0hdca	Trump team wins hearings in Arizona, Michigan and Pennsylvania legislatures on election concerns	
t3_jymfwh	Wisconsin election officials say Trump observers obstructing recount, some ‘clearly don’t know what they are doing’	
t3_jztm0i	Trump Campaign’s Actual Argument in Appeals Court: We’re Only Trying to Disenfranchise 1.5 Million Voters, Not 6 Million Pennsylvanians	
t3_jyzl4l	Trump slams global climate agreement Biden intends to rejoin	
t3_k0axma	Biden win over Trump in Nevada made official by court	
t3_jytpjk	Pa. Senator Pat Toomey Says President Trump Has 'Exhausted All Plausible Legal Options'	
t3_k0f9nk	Where are the Republican Politicians? Have they Deserted Trump?	
t3_jy6h4r	Romney on Trump election tactics: 'Difficult to imagine a worse, more undemocratic action' by president	
t3_jzgode	Trump axed campaign lawyer Sidney Powell was because 'she was too conspiratorial even for him'	
t3_jz0yry	GOP Governor On Trump's Election Tantrum: Beginning To Look Like A 'Banana Republic' - "Frankly, I'm embarrassed that more people in the party aren’t speaking up," Maryland Gov. Larry Hogan said.	
t3_k0h2s8	Trump Wonders If He Should Have Gone With A Lawyer From The Yellow Pages Instead Of Leaky Rudy — The cases would still have been BS, but it would have been less humiliating.	
t3_jztlp5	G.M. Drops Its Support for Trump Climate Rollbacks and Aligns With Biden	
t3_jzgz98	John Kasich Stunned GOP Isn’t Defending Democracy Against Trump	
t3_k0fgz7	Biden says he'd meet with Trump 'if he asked'	
t3_jzpr6u	Trump Wants 3rd Circuit to Halt Pennsylvania Certification	
t3_jz6gek	Trump campaign cuts Sidney Powell from president’s legal team - The abrupt shake-up comes as Powell makes far-fetched and unsupported claims of voter fraud in the 2020 elections.	
t3_jxszoj	Federal Judge Strikes DOJ from the Docket in E. Jean Carroll’s Case Against Donald Trump	
t3_jz088i	Trump team making false argument about his 2016 transition	
t3_jyo1za	Donald Trump appears to admit Covid is 'running wild' in the US	
t3_jzu0rh	Rush Limbaugh On Trump’s Legal Team: ‘They Promised Blockbuster Stuff And Then Nothing Happened’	
t3_k01ja2	Alan Dershowitz Says Trump Still Has ‘Two or Three Constitutional Paths’ To A 2020 Victory – But He Hasn’t Seen The Evidence To Overturn	
t3_jya72i	Two weeks after Biden named President-elect, Trump faces stinging setbacks	
t3_jywmds	Split-screen: Biden preps to be president, Trump fights for the job he is ignoring	
t3_jzmfmo	President Trump Wanted a Supreme Court Election Battle. His Current Appeal Simply Cannot Get Him There.	
t3_jzs6yd	PolitiFact - Trump's Pants on Fire claim about votes exceeding voters in swing states	
t3_jyfij4	Georgia Gov. Kemp Calls for Audit, Says Trump Can Demand New Recount	
t3_jzwgzq	Rush Limbaugh, Michigan, GSA hammer nails into coffin of Trump's election fraud claims	
t3_jz0eog	In Public, Trump Still Claims He Won. In Private, Aides Say He’s Planning for Life After Presidency.	
t3_k0d1g3	'Well That Was Weird as Sh*t': As More States Certify His Defeat, Trump Holds 60-Second Briefing to Brag About Stock Market	
t3_jz3yzg	Pompeo says Mideast strategy will be Trump administration policy 'until our time is complete'	
t3_k084zn	FNC's Laura Ingraham: 'I Would Be Lying to You' if I Said There Was an 'Excellent' Chance SCOTUS Delivers Victory to Trump	
t3_jzo4ys	To Prevent 'Active Sabotage' of His Agenda, Biden Urged to Clean House of Trump Loyalists on Day One	
t3_k08slh	On Night of Ginsburg’s Death, McConnell Pushed Trump to Nominate Amy Coney Barrett	
t3_jyc1ze	Voice of America's 5 Months Under Trump CEO: Lawsuits, Bias Claims, And A Sex Scandal	
t3_k0djl7	Trump Insists He’s Still Going to Be President as White House Landlord Asks For Forwarding Address for Security Deposit	
t3_jxraf0	While You Were Focused on The Kraken, the Senate Continued Confirming Trump Federal Judges	
t3_jyww10	Trump administration pulls out of Open Skies Treaty with Russia	
t3_jyoq50	Trump calls on GOP state legislatures to overturn election results	
t3_jzjwz1	100 Republican national security experts demand GOP admit Trump loss	
t3_jyebbg	GOP asks Michigan not to certify election results, citing ‘irregularities’ | The move follows speculation that Trump is seeking to persuade Michigan Republicans to override election results	
t3_jyyaoi	Trump Requests Georgia Recount, Meaning 5 Million Votes Will Be Tabulated A 3rd Time	
t3_jy0zg7	Editorial: Trump’s effort to steal the election is a step toward fascism in America. If you call yourself a patriot, you can’t support it	
t3_jyg34p	Trump Using Last Days to Lock in Policies and Make Biden’s Task More Difficult	
t3_jyq2xw	Georgia will conduct recount after Trump campaign request	
t3_jzo8pn	GM flips to California's side in pollution fight with Trump	
t3_jyyf6p	'Unacceptable': Wisconsin Election Officials Say Trump Observers Hindering Recount With Constant Interruptions, Questions	
t3_jzpvbh	Rush Limbaugh criticizes Trump legal team for promising 'bombshells' and failing to deliver	
t3_jzny0i	Pennsylvania Republicans Voted Against Certifying Vote in County Trump Won by 22,000	
t3_jyegwu	Wall Street Journal Bails on Trump’s ‘Conspiracy Theory,’ Says Giuliani is Not a ‘Serious Practicing Attorney	
t3_jz5rv6	Trump campaign says Sidney Powell not a member of legal team	
t3_jyuofr	Judge rules against Trump global media chief after firings | A federal judge has ruled against the head of the agency that runs the Voice of America and other U.S.-funded news outlets who was accused of trying to turn it into a propaganda vehicle to promote President Donald Trump’s agenda	
t3_jyzpvt	How Trump Responded When Liz Cheney Called on Him to Concede: "Sorry Liz, can’t accept the results of an election with hundreds of thousands of fraudulent votes cast, enough to easily flip the Election. You’re just unhappy that I’m bringing the troops back home where they belong!"	
t3_jzsrxm	General Motors abandons Trump in lawsuit fighting California on its own climate rules and vows to work on crisis with Biden	
t3_jz003m	Chris Christie calls Trump's legal team a 'national embarrassment'	
t3_k0ahv4	Judge Emmet Sullivan Will Oversee Voting Rights Act Case Accusing Trump of Anti-Black Campaign to Overturn Election	
t3_jz088i	Trump team making false argument about his 2016 transition	
t3_jyyaoi	Trump Requests Georgia Recount, Meaning 5 Million Votes Will Be Tabulated A 3rd Time	
t3_jyj5z6	Detroit voters sue Donald Trump over unsubstantiated claims of voter fraud	
t3_jy0een	Rudy Giuliani's Son Potentially Exposed Most of Trump's Legal Team to COVID During RNC Press Conference	
t3_jz7lhm	Edward Norton tears into 'whiny, sulky, petulant, Grinchy, vindictive' Donald Trump in pointed, poker-laced Twitter thread	
t3_jyn1nu	'Absolutely shameful': Schiff condemns Trump's golf outing	
t3_jy6x6f	Whatever Happens In The Next Few Weeks, Brothers and Sisters, Remember This Clip, My Favorite 60 seconds of Trump: 'I am your voice'	
t3_jze7sy	Trump election challenges sound alarm among voters of color	
t3_jydj00	LIVE: March for Trump in Atlanta, Georgia	
t3_k0anru	Trump pops into White House briefing room for one-minute impromptu speech	
t3_k0dsct	Trump Advisers Pushed for Transition as GOP Calls Grew	
t3_k063d1	The Real Reason Trump’s Lawsuits Disproportionately Target Black and Latino Voters	
t3_jyy2z6	Bolton calls on GOP leadership to label Trump's behavior 'inexcusable'	
t3_jyn7r5	US election results: Why Trump increased support among non-whites	
t3_jyk4r9	Liz Cheney: Trump should respect ‘the sanctity of our electoral process’	
t3_jxsfmb	Whoa: Nearly a Third of Democrats Believe the Election Was Stolen From Trump	
t3_jyobi4	Michigan Legislators Face Calls For Possible Criminal Charges After Meeting With President Trump On Certification	
t3_jzjoc9	Republican former national security officials urge party to demand Trump concession	
t3_jyj6r2	Judge rules against Trump global media chief after firings	
t3_jzrspx	'Special jeopardy': 100 former Republican national security officials warn Trump must allow transition	
t3_jzvxxd	Trump campaign loses 5 more cases in Pennsylvania Supreme Court decision	
t3_jzke5q	Interior Department contender says Biden would target Trump Arctic drilling push on first day	
t3_jyca1s	The Trump campaign’s much-hyped affidavit features a big, glaring error	
t3_jzs2sh	Carl Bernstein says 21 Republican members of U.S. Senate have expressed disdain for Trump	
t3_jzd94c	Carl Bernstein Names Names: 21 GOP Senators Who've Privately Ripped Trump	
t3_jyoi1n	"Trump has exhausted all plausible legal options": GOP Sen. Pat Toomey congratulates Biden	
t3_jyusgt	Ben Carson: Trump Saved My Life After I Got COVID	
t3_jzk9j0	Sidney Powell Responds to Trump Campaign's Statement Saying She's Not Part of Legal Team -- Powell said her fight will go on anyway and closed her statement with the hashtag, "#KrakenOnSteroids"	
t3_jykt0d	Michigan AG Suggests Criminally Charging Republican Legislators for Meeting With Trump	
t3_jxqrev	Giuliani: ‘Massive Fraud’: Trump lawyers present chapter and verse in presser	
t3_jzjii3	Mark Levin: Letting Trump's legal efforts play out far better than 'what the Democrats are doing to our institutions'	
t3_jz4z41	No, You Do Not Have to Feel the Trump Voter's Pain | There is no reason, after five and half years of untruths, dog-whistles, slurs and conspiracies, and weeks of Trump trying to undermine Biden’s win, to hug the people who want to disenfranchise you	
t3_jycwb6	Meet Pennsylvania’s anger translator, and Donald Trump’s worst nightmare	
t3_k02fcy	Trump’s national security adviser floats a 2024 bid with friends	
t3_jyr204	Trump campaign files for new recount in Georgia	
t3_jyfn88	Trump tweets about election results and skips session on pandemic during G20	
t3_jzqf5t	Republican Congressman Says GOP 'Embarrassing,' Calls on Party to 'Denounce' Trump's 'Conspiracy Theories'	
t3_jy2mf4	Anger builds in Black community over Trump’s claims of voter fraud in big cities	
t3_jyvwlr	Democrats gear up for last oversight showdown with Trump	
t3_jzq0dh	Biden’s Europe challenge: Repair tattered transatlantic ties | Four years of Donald Trump have done serious damage to mutual trust.	
t3_jxw9t2	After Years of Watching ‘Trump Show,’ TV News Starts to Turn it Off	
t3_k0f57y	Shirkey: Lawmakers told Trump they have no role in election	
t3_jzhzmd	Reporter Carl Bernstein names 21 GOP senators who 'repeatedly expressed extreme contempt for Trump'	
t3_jzmj9c	Political Enemy List Trump Accountability Project Publicly Posted on Their Website	
t3_jygs96	Merkel's Germany Tells Trump Not to Bring Troops Home from Afghanistan	
t3_jyhutc	Obama jokes that Navy SEALs could remove Trump from the White House	
t3_jzszg1	Michigan certifies Biden victory as Trump’s legal team suffers further losses	
t3_jxifvj	Romney accuses Trump of trying to ‘subvert the will of the people’ with election challenges	
t3_jzqp20	Trump-Appointed Judges Find Conversion Therapy Bans Unconstitutional	
t3_jyunuj	Trump campaign adviser Steve Cortes: Sudden Stop In Mail-In Vote Count 'Suspicious' -- Particularly since it was followed by a "deluge" of votes for Joe Biden in key battleground states.	
t3_jy0nxd	Donald Trump Jr tests positive for coronavirus	
t3_jygwhl	Donald Trump Improved Standing With Latinos In 78 Of America’s 100 Majority-Hispanic Counties	
t3_k07siq	Mark Hamill Reacts to Trump Considering Randy Quaid's Call for Election 'Do-Over'	
t3_jywxtu	Michigan GOP Congressman Tells Trump 'It's Over': 'The Voters Spoke'	
t3_jxz18x	OMB Documents Obtained by Chairs Yarmuth, Lowey, Maloney Show Trump Admin Withheld WHO Funds to Combat the Coronavirus Pandemic with Same Tactic Used in Illegal Ukraine Impoundment	
t3_jyemqz	Donald Trump Will Lose One Of His Twitter Accounts To Joe Biden On Inauguration Day. An account the president uses to retweet his conspiracy theories and vitriol will be wiped and handed over to the Biden administration.	
t3_jzsruy	Rush Limbaugh Does Full 180, Blasts Sidney Powell After Team Trump Disavowed Her	
t3_jxdun5	After Insulting Trump Voters For Years, NYT Writer Complains Reaching Out To Them Is A 'Waste Of Time'	
t3_jyby64	Business and World Leaders Move On as Trump Fights to Reverse Election | President-elect Joseph R. Biden Jr. is seizing the moment, not to aggressively confront the president he defeated, but to act presidential in his stead.	
t3_k047z0	Press: Trump's biggest fear is — lock him up	
t3_jz3iys	Small but growing number of Republicans tell Trump it's over: "Stop golfing and concede"	
t3_jyeldv	A new lawsuit alleges Trump’s effort to overturn Michigan’s election results disenfranchises Black voters	
t3_jzgzo5	Trump is not just refusing to concede, he is sabotaging nation’s interest	
t3_jzw3ni	75 Percent Of Lawyers Say They Wouldn’t Support Their Firm If They Represented Donald Trump — Lawyers do *not* approve of what Jones Day's doing.	
t3_jxraqc	New York Investigations Into Trump Have Reportedly Expanded to Cover Millions in Questionable Tax Write-Offs	
t3_jyobi4	Michigan Legislators Face Calls For Possible Criminal Charges After Meeting With President Trump On Certification	
t3_k05kkv	Every Day Trump Repeatedly Emails His Supporters a Dangerous Message: Democracy Doesn’t Work. Be outraged, don’t accept the election results…and send money.	
t3_k0b0kz	Trump vows he’ll ‘never concede’ despite administration starting transition move	
t3_jyqh97	Chinese Warn Against Communism at Trump Rally, Tell Americans to Speak Out	
t3_k0c7j8	Chris Evans, Zach Braff Want A List Of ‘Trump Enablers’	
t3_jyby0o	Trump Announces Groundbreaking Rules to Lower Prescription Drug Prices	
t3_jztfqa	Trump Wars II: The Loser Strikes Back	
t3_jz3tv7	Ronna McDaniel has reportedly warned Donald Trump Jr., Kimberly Guilfoyle could succeed her as RNC chair	
t3_jz1ita	Biden adviser: Trump seeking to 'subvert the democratic system' with legal challenges	
t3_k0gbii	Pennsylvania Urges Third Circuit to Put Trump Campaign’s ‘Frankenstein’s Monster’s Monster’ Lawsuit Out of Its Misery	
t3_jydzd2	Twitter says it will hand control of US president's official account to Joe Biden on January 20 - regardless of whether Donald Trump has left the White House	
t3_jykyw7	Federal Election Commission Chair: Trump Campaign Has Legitimate Claims of Election Fraud	
t3_k0hoks	Biden doesn’t rule out his Justice Department investigating Trump	
t3_jzq15s	Rush Limbaugh: Trump Needs to Hold Rallies in Georgia	
t3_jzfnsj	Biden to spotlight CDC officials shunned by Trump	
t3_jy93rj	Dear Trump supporters: Those who egg on the president now, given the damage he does to America, are truly reprehensible	
t3_jzmq37	Column: Trump’s Afghan plan could snatch catastrophe from the jaws of defeat	
t3_jyehxb	No, Venezuelan communists did not interfere in the election. Yes, Trump’s legal team claimed that.	
t3_jzsm35	Michigan election board certifies 154,000-vote victory for Joe Biden, another setback in Trump’s effort to overturn election results	
t3_k05r0v	Enough cowardice: Democrats must forge ahead, without caring what the Trumpers say	
t3_jyp5q9	Actor Scott Baio threatens to move to Utah to unseat Sen. Mitt Romney after his anti-Trump tweet	
t3_jzqrab	Poll: Americans Want Biden to Stay Out of Trump Investigations &amp; Pass on Progressive Policies for Now	
t3_jy0dkc	Donald Trump Jr. tests positive for COVID-19	
t3_jyi1mt	Trump campaign "seeking to disenfranchise Black voters" with election fraud claims: lawsuit	
t3_jyxn1c	Chris Christie: Trump's legal challenges against election results have been "a national embarrassment"	
t3_k0azls	Trump’s Enablers Are Sabotaging the Georgia Senate Runoff Election–and Helping Democrats. There’s a weird, right-wing push to boycott January’s pivotal U.S. Senate runoffs. Is Trump angry enough to join it?	
t3_jyi19h	Trump Is Staging a Comically Incompetent Coup — It would almost be possible to laugh at this debacle if the stakes weren’t so serious.	
t3_k0942q	Melania Trump wanted to light the White House with rainbow colors for Pride month. She got told no.	
t3_jyj74r	Judge bars Trump appointee from interfering in Voice of America	
t3_k02t1v	Poll: Majority of Republicans would support Trump in 2024	
t3_k0h214	“This Keeps Me Up at Night”: Radicalization Experts Fear What Trump’s Fringes Will Do Now	
t3_k07b93	Donald Trump Is Now Retweeting Randy Quaid’s Election Rants And Do-Over Calls	
t3_jzitza	Why The Left Can Be So Ridiculously Self-Righteous Without Realizing It -- What we saw in the lead up to the elections, and what we’ll witness for years to come, is utter contempt for Trump voters and conservatives in general.	
t3_jylfat	Hispanic Voters In Florida Who Fled Dictatorships Think The Election Was Stolen From Trump	
t3_jzu8wb	Trump accepts transition to Biden can begin	
t3_jyomso	GOP senator congratulates Biden, says Trump should accept results	
t3_jzrzv8	Rush Limbaugh Knocks Trump's Lawyers For Not Providing Voter Fraud Proof	
t3_jz9j4j	Trump legal team shuns Sidney Powell as insiders and national security officials see no evidence supporting her voting machine claims	
t3_jz3bhq	Pennsylvania election: Trump appeals dismissal of bid to block vote certification	
t3_k0097h	Twitter Critics Can't Even: Trump Reportedly Blames Legal Team For Making Him Look Bad	
t3_jzsfqc	First Latino tapped to head DHS signals shift from Trump's hard-line immigration policies	
t3_jznjcm	Post-Trump, his party and his favorite network have to figure out their relationship with reality	
t3_jyau1p	GOP lawmaker patience runs thin with Trump tactics	
t3_jz2tha	Trump obsession: Democrats tweet about him 12,569 times to 486 about Biden	
t3_jys6cg	Florida man still pitching trailer park as site of future Trump presidential library	
t3_jyxqd1	Chris Christie: Trump's legal team 'a national embarrassment'	
t3_jyl201	A vindictive Trump seeks to undermine Biden’s presidency	
t3_jzv4kr	GM withdraws support for Trump lawsuit seeking to roll back auto emissions rules	
t3_jyxte1	Trump’s Legal Team Cried Voter Fraud, But Courts Found None	
t3_jxxh0e	Detroit asks judge to sanction Trump campaign for spreading 'disinformation'	
t3_jzmj9c	Political Enemy List Trump Accountability Project Publicly Posted on Their Website	
t3_jz0yry	GOP Governor On Trump's Election Tantrum: Beginning To Look Like A 'Banana Republic' - "Frankly, I'm embarrassed that more people in the party aren’t speaking up," Maryland Gov. Larry Hogan said.	
t3_jy0nxd	Donald Trump Jr tests positive for coronavirus	
t3_jzg8jv	The One Word That Bars Trump From Pardoning Himself: The question shouldn’t be whether the president can pardon himself but whether he can grant himself a pardon—and those are not the same thing.	
t3_jzlacq	Donald Trump finally found someone with a too-crazy conspiracy theory about the 2020 election	
t3_jzfpdr	Donald Trump has assaulted our democracy	
t3_k0bfgp	Trump shares bizarre videos and tweets by actor Randy Quaid about voter fraud, Fox News	
t3_jzc781	John Kasich calls Trump's refusal to concede 'absurd'	
t3_jzjwz1	100 Republican national security experts demand GOP admit Trump loss	
t3_jyw2mu	Trump threatens to wreak havoc on the GOP from beyond the White House	
t3_k07jm6	Column: Trump lost and his lawsuits are garbage. But please keep donating! The grift must go on.	
t3_jyxn1c	Chris Christie: Trump's legal challenges against election results have been "a national embarrassment"	
t3_k0927g	How Can We Get Rid of Our Trump-Era Brainworms?	
t3_jzba0d	Carl Bernstein names 21 GOP senators who 'privately expressed their disdain' for Trump	
t3_jzqg3e	Trump campaign suffers new court loss in attempt to block Biden’s win in Pennsylvania	
t3_jyn27t	FDA authroizes emergency use of Regeneron antibody treatment given to Trump	
t3_jzlnvy	A major Trump donor’s company got a 3 percent government-backed pandemic loan. It sells title loans at a 350 percent annual rate.	
t3_jzhsuf	Trump urges state legislatures and courts to ‘flip’ results	
t3_jyxn1c	Chris Christie: Trump's legal challenges against election results have been "a national embarrassment"	
t3_jzpddc	Land conservation plan stirs fight over Trump restrictions	
t3_jyby0o	Trump Announces Groundbreaking Rules to Lower Prescription Drug Prices	
t3_jztbkw	As Fox News breaks up with Trump, new sweethearts emerge	
t3_jz3pdw	Wisconsin officials: Trump observers obstructing recount	
t3_jyyvlv	Twitter Recognizes Biden as the Next @POTUS, Despite Trump's Denial	
t3_jz4v45	Longtime diplomat says Trump conspiracies hurt U.S. more than Russia, China	
